<?xml version="1.0" encoding="UTF-8"?>
<specification url="http://hl7.org/fhir/uv/genomics-reporting" ciUrl="http://build.fhir.org/ig/HL7/genomics-reporting" defaultWorkgroup="cg" xmlns:xsi="http://www.w3.org/2001/XMLSchema-instance" xsi:noNamespaceSchemaLocation="schemas/specification.xsd">
  <artifactPageExtension value="-definitions"/>
  <artifactPageExtension value="-examples"/>
  <artifactPageExtension value="-mappings"/>
  <artifacts name="Observation" key="Observation"/>
  <artifacts name="Sequence" key="Sequence"/>
  <pages name="(NA)" key="NA"/>
  <pages name="(many)" key="many"/>
  <pages name="(profiles)" key="profiles"/>
</specification>
