<?xml version="1.0" encoding="UTF-8"?>
<specification url="http://hl7.org/fhir/us/sdc" ciUrl="https://build.fhir.org/ig/HL7/sdc" defaultWorkgroup="fhir-i" xmlns:xsi="http://www.w3.org/2001/XMLSchema-instance" xsi:noNamespaceSchemaLocation="schemas/specification.xsd">
  <artifactPageExtension value="-definitions"/>
  <artifactPageExtension value="-examples"/>
  <artifactPageExtension value="-mappings"/>
  <artifacts name="CapabilityStatement (Conformance)" key="Conformance" deprecated="true"/>
  <artifacts name="DataElement (see StructureDefinition)" key="DataElement" deprecated="true"/>
  <artifacts name="Questionnaire" key="Questionnaire" deprecated="true"/>
  <artifacts name="QuestionnaireResponse" key="QuestionnaireAnswers" deprecated="true"/>
  <pages name="(NA)" key="NA"/>
  <pages name="(many)" key="many"/>
  <pages name="(methodology)" key="methodology"/>
  <pages name="(profiles)" key="profiles"/>
  <pages name="Home (index)" key="index" url="index"/>
  <pages name="Implementation Registry (registry/iglist)" key="iglist" url="registry" deprecated="true"/>
</specification>
