<?xml version="1.0" encoding="UTF-8"?>
<specification url="http://hl7.org/fhir/uv/vhdir" ciUrl="http://build.fhir.org/ig/HL7/VhDir" defaultWorkgroup="pa" xmlns:xsi="http://www.w3.org/2001/XMLSchema-instance" xsi:noNamespaceSchemaLocation="schemas/specification.xsd">
  <artifactPageExtension value="-definitions"/>
  <artifactPageExtension value="-examples"/>
  <artifactPageExtension value="-mappings"/>
  <artifacts name="Organization" key="Organization" deprecated="true"/>
  <artifacts name="OrganizationRole" key="OrganizationRole" deprecated="true"/>
  <artifacts name="Practitioner" key="Practitioner" deprecated="true"/>
  <artifacts name="PractitionerRole" key="PractitionerRole" deprecated="true"/>
  <pages name="(NA)" key="NA"/>
  <pages name="(many)" key="many"/>
  <pages name="(profiles)" key="profiles"/>
  <pages name="Home (index)" key="index" url="index"/>
</specification>
