<?xml version="1.0" encoding="UTF-8"?>
<specification url="http://www.fhir.org/guides/argonaut" ciUrl="https://build.fhir.org/ig/argonautproject/data-query" defaultWorkgroup="us-realm" xmlns:xsi="http://www.w3.org/2001/XMLSchema-instance" xsi:noNamespaceSchemaLocation="schemas/specification.xsd">
  <artifactPageExtension value="-definitions"/>
  <artifactPageExtension value="-examples"/>
  <artifactPageExtension value="-mappings"/>
  <artifacts name="AuditEvent" key="AuditEvent"/>
  <artifacts name="Provenance" key="Provenance"/>
  <artifacts name="StructureDefinition" key="StructureDefinition"/>
  <pages name="(NA)" key="NA"/>
  <pages name="(many)" key="many"/>
  <pages name="(profiles)" key="profiles"/>
  <pages name="Argnonauts" key="argonauts" url="argnonauts" deprecated="true"/>
</specification>
