<?xml version="1.0" encoding="UTF-8"?>
<specification defaultWorkgroup="oo" xmlns:xsi="http://www.w3.org/2001/XMLSchema-instance" xsi:noNamespaceSchemaLocation="schemas/specification.xsd">
  <artifactPageExtension value="-definitions"/>
  <artifactPageExtension value="-examples"/>
  <artifactPageExtension value="-mappings"/>
  <artifacts name="Observation" key="Observation"/>
  <artifacts name="ValueSet" key="ValueSet"/>
  <pages name="(NA)" key="NA"/>
  <pages name="(many)" key="many"/>
  <pages name="(profiles)" key="profiles"/>
  <pages name="Terminologies - Systems" key="terminologies-systems" url="terminologies-systems"/>
</specification>
