<?xml version="1.0" encoding="UTF-8"?>
<specification url="http://hl7.org/fhir/us/sdcde" ciUrl="http://build.fhir.org/ig/HL7/sdc-de" defaultWorkgroup="fhir-i" xmlns:xsi="http://www.w3.org/2001/XMLSchema-instance" xsi:noNamespaceSchemaLocation="schemas/specification.xsd">
  <artifactPageExtension value="-definitions"/>
  <artifactPageExtension value="-examples"/>
  <artifactPageExtension value="-mappings"/>
  <artifacts name="DataElement (see StructureDefinition)" key="DataElement" deprecated="true"/>
  <pages name="(NA)" key="NA"/>
  <pages name="(many)" key="many"/>
  <pages name="(profiles)" key="profiles"/>
  <pages name="ElementDefinition" key="elementdefinition" url="elementdefinition" deprecated="true"/>
</specification>
