<?xml version="1.0" encoding="UTF-8"?>
<specification url="http://hl7.org/fhir/us/daf" ciUrl="https://build.fhir.org/ig/HL7/daf-research" defaultWorkgroup="fhir-i" xmlns:xsi="http://www.w3.org/2001/XMLSchema-instance" xsi:noNamespaceSchemaLocation="schemas/specification.xsd">
  <artifactPageExtension value="-definitions"/>
  <artifactPageExtension value="-examples"/>
  <artifactPageExtension value="-mappings"/>
  <artifacts name="Patient" key="Patient"/>
  <artifacts name="ResearchStudy" key="ResearchStudy"/>
  <pages name="(NA)" key="NA"/>
  <pages name="(many)" key="many"/>
  <pages name="(profiles)" key="profiles"/>
</specification>
