<?xml version="1.0" encoding="UTF-8"?>
<!-- This data is just for testing purposes and is not complete -->
<specification defaultWorkgroup="sd" xmlns:xsi="http://www.w3.org/2001/XMLSchema-instance" xsi:noNamespaceSchemaLocation="schemas/specification.xsd">
  <artifacts name="SomeClass" key="someclass"/>
  <artifacts name="SomeOtherClass" key="someotherclass"/>
  <pages name="(NA)" key="NA"/>
  <pages name="(many)" key="many"/>
  <pages name="(methodology)" key="methodology"/>
  <pages name="(profiles)" key="profiles"/>
  <pages name="Intro" key="intro"/>
</specification>
