<?xml version="1.0" encoding="UTF-8"?>
<specification url="http://hl7.org/fhir/uv/ecr" ciUrl="http://build.fhir.org/ig/HL7/case-reporting" defaultWorkgroup="pher" xmlns:xsi="http://www.w3.org/2001/XMLSchema-instance" xsi:noNamespaceSchemaLocation="schemas/specification.xsd">
  <artifactPageExtension value="-definitions"/>
  <artifactPageExtension value="-examples"/>
  <artifactPageExtension value="-mappings"/>
  <artifacts name="CodeSystem" key="CodeSystem" deprecated="true"/>
  <artifacts name="Composition" key="Composition" deprecated="true"/>
  <artifacts name="Encounter" key="Encounter" deprecated="true"/>
  <artifacts name="StructureDefinition" key="StructureDefinition" deprecated="true"/>
  <artifacts name="ValueSet" key="ValueSet" deprecated="true"/>
  <pages name="(NA)" key="NA"/>
  <pages name="(profiles)" key="profiles"/>
  <pages name="Ballot Intro" key="ballot-intro" url="ballot-intro" deprecated="true"/>
  <pages name="Element" key="element" url="element" deprecated="true"/>
  <pages name="Home (index)" key="index" url="index"/>
</specification>
