<?xml version="1.0" encoding="UTF-8"?>
<specification url="http://hl7.org/fhir/uv/immds" ciUrl="http://build.fhir.org/ig/HL7/ImmunizationFHIRDS" defaultWorkgroup="pher" xmlns:xsi="http://www.w3.org/2001/XMLSchema-instance" xsi:noNamespaceSchemaLocation="schemas/specification.xsd">
  <artifactPageExtension value="-definitions"/>
  <artifactPageExtension value="-examples"/>
  <artifactPageExtension value="-mappings"/>
  <artifacts name="Immunization" key="Immunization" deprecated="true"/>
  <artifacts name="ImmunizationRecommendation" key="ImmunizationRecommendation" deprecated="true"/>
  <artifacts name="Patient" key="Patient" deprecated="true"/>
  <pages name="(NA)" key="NA"/>
  <pages name="(many)" key="many"/>
  <pages name="(profiles)" key="profiles"/>
</specification>
