<?xml version="1.0" encoding="UTF-8"?>
<specification url="http://hl7.org/fhir/us/qicore" ciUrl="https://build.fhir.org/ig/cqframework/qi-core" defaultWorkgroup="cqi" xmlns:xsi="http://www.w3.org/2001/XMLSchema-instance" xsi:noNamespaceSchemaLocation="schemas/specification.xsd">
  <artifactPageExtension value="-definitions"/>
  <artifactPageExtension value="-examples"/>
  <artifactPageExtension value="-mappings"/>
  <artifacts name="AllergyIntolerance" key="AllergyIntolerance"/>
  <artifacts name="Condition" key="Condition"/>
  <artifacts name="Encounter" key="Encounter"/>
  <artifacts name="Goal" key="Goal"/>
  <artifacts name="ImagingStudy" key="ImagingStudy"/>
  <artifacts name="MedicationRequest" key="MedicationPrescription"/>
  <artifacts name="Patient" key="Patient"/>
  <artifacts name="StructureDefinition" key="StructureDefinition"/>
  <pages name="(NA)" key="NA"/>
  <pages name="(many)" key="many"/>
  <pages name="(profiles)" key="profiles"/>
  <pages name="Home (index)" key="index" url="index"/>
</specification>
