<?xml version="1.0" encoding="UTF-8"?>
<specification url="http://hl7.org/fhir/us/core" ciUrl="http://build.fhir.org/ig/HL7/US-Core" defaultWorkgroup="us-realm" xmlns:xsi="http://www.w3.org/2001/XMLSchema-instance" xsi:noNamespaceSchemaLocation="schemas/specification.xsd">
  <artifactPageExtension value="-definitions"/>
  <artifactPageExtension value="-examples"/>
  <artifactPageExtension value="-mappings"/>
  <artifacts name="AllergyIntolerance" key="AllergyIntolerance" deprecated="true"/>
  <artifacts name="AuditEvent" key="AuditEvent" deprecated="true"/>
  <artifacts name="CarePlan" key="CarePlan" deprecated="true"/>
  <artifacts name="CareTeam" key="CareTeam" deprecated="true"/>
  <artifacts name="Composition" key="Composition" deprecated="true"/>
  <artifacts name="Condition" key="Condition" deprecated="true"/>
  <artifacts name="DiagnosticRequest (see ServiceRequest)" key="DiagnosticRequest" deprecated="true"/>
  <artifacts name="DiagnosticReport" key="DiagnosticReport" deprecated="true"/>
  <artifacts name="DocumentReference" key="DocumentReference" deprecated="true"/>
  <artifacts name="Encounter" key="Encounter" deprecated="true"/>
  <artifacts name="FamilyMemberHistory" key="FamilyHistory" deprecated="true"/>
  <artifacts name="Immunization" key="Immunization" deprecated="true"/>
  <artifacts name="List" key="List" deprecated="true"/>
  <artifacts name="Location" key="Location" deprecated="true"/>
  <artifacts name="Measure" key="Measure" deprecated="true"/>
  <artifacts name="MedicationAdministration" key="MedicationAdministration" deprecated="true"/>
  <artifacts name="MedicationRequest" key="MedicationPrescription" deprecated="true"/>
  <artifacts name="Observation" key="Observation" deprecated="true"/>
  <artifacts name="Organization" key="Organization" deprecated="true"/>
  <artifacts name="Patient" key="Patient" deprecated="true"/>
  <artifacts name="Practitioner" key="Practitioner" deprecated="true"/>
  <artifacts name="PractitionerRole" key="PractitionerRole" deprecated="true"/>
  <artifacts name="Procedure" key="Procedure" deprecated="true"/>
  <artifacts name="Provenance" key="Provenance" deprecated="true"/>
  <artifacts name="Specimen" key="Specimen" deprecated="true"/>
  <artifacts name="StructureDefinition" key="StructureDefinition" deprecated="true"/>
  <artifacts name="ValueSet" key="ValueSet" deprecated="true"/>
  <pages name="(NA)" key="NA"/>
  <pages name="(many)" key="many"/>
  <pages name="(methodology)" key="methodology"/>
  <pages name="(profiles)" key="profiles"/>
  <pages name="Schemas &amp; Schematrons" key="schemas-schematrons" deprecated="true"/>
  <pages name="Argnonauts" key="argonauts" url="argnonauts" deprecated="true"/>
  <pages name="Home (index)" key="index" url="index" deprecated="true"/>
  <pages name="Implementation Registry (registry/iglist)" key="iglist" url="registry" deprecated="true"/>
  <pages name="Terminologies - Systems" key="terminologies-systems" url="terminologies-systems" deprecated="true"/>
</specification>
