<?xml version="1.0" encoding="UTF-8"?>
<specification url="http://hl7.org/fhir/us/ccda" ciUrl="https://build.fhir.org/ig/HL7/ccda-on-fhir" defaultWorkgroup="sd" xmlns:xsi="http://www.w3.org/2001/XMLSchema-instance" xsi:noNamespaceSchemaLocation="schemas/specification.xsd">
  <artifactPageExtension value="-definitions"/>
  <artifactPageExtension value="-examples"/>
  <artifactPageExtension value="-mappings"/>
  <artifacts name="AuditEvent" key="AuditEvent" deprecated="true"/>
  <artifacts name="Composition" key="Composition" deprecated="true"/>
  <artifacts name="Provenance" key="Provenance" deprecated="true"/>
  <artifacts name="StructureDefinition" key="StructureDefinition" deprecated="true"/>
  <artifacts name="ValueSet" key="ValueSet" deprecated="true"/>
  <pages name="(NA)" key="NA"/>
  <pages name="(many)" key="many"/>
  <pages name="(methodology)" key="methodology"/>
  <pages name="(profiles)" key="profiles"/>
  <pages name="Implementation (see Documentation)" key="implementation" url="implementation" deprecated="true"/>
</specification>
